{
  "schema_version": "0.1.0",
  "run_id": "run_9a8b7c",
  "trajectory_id": "traj_claude_struct_001",
  "task_id": "T1_auth_refactor",
  "rulepack_id": "rp_strict_v2",
  "target": {
    "workspace_path": "/tmp/harness_workspaces/run_9a8b7c",
    "pre_commit": "a1b2c3d4",
    "post_commit": "e5f6g7h8",
    "baseline_commit": "base0000"
  },
  "env_snapshot": {
    "node_version": "v20.11.0",
    "pnpm_version": "8.15.4",
    "harness_commit": "deadbeef123",
    "os": "darwin-arm64",
    "tool_versions": {
      "eslint": "8.56.0",
      "jest": "29.7.0"
    }
  },
  "layers": {
    "constraints": [
      {
        "name": "no-syntax-errors",
        "version": "1.0.0",
        "status": "pass",
        "findings": [],
        "raw_artifact_path": "artifacts/constraints/no-syntax-errors.log"
      }
    ],
    "metrics": [
      {
        "name": "cyclomatic-complexity",
        "version": "2.1.0",
        "status": "pass",
        "score": 12.5,
        "raw_artifact_path": "artifacts/metrics/complexity.json"
      }
    ],
    "judgments": [
      {
        "name": "llm-architecture-compliance",
        "version": "gpt-4-0125",
        "status": "pass",
        "score": 85.0,
        "findings": ["Follows NestJS DI patterns", "Missing one edge case in error handling"],
        "raw_artifact_path": "artifacts/judgments/arch-compliance.json"
      }
    ]
  },
  "deltas": {
    "run_local": {
      "complexity_delta": -2.5,
      "test_coverage_delta": 1.2
    },
    "trajectory_cumulative": {
      "complexity_delta": -5.0,
      "test_coverage_delta": 4.5
    }
  },
  "duration_ms": 45230,
  "status": "completed",
  "errors": []
}